CPU: ID 0x806e9, Processor Type 0x0, Family 0x6, Model 0x8e, Stepping 0x9
Northbridge: 8086:5904 (7th generation (Kaby Lake family) Core Processor (Mobile))
Southbridge: 8086:9d4e (Sunrise Point-LP U iHDCP 2.2 Premium)
IGD: 8086:5916 (unknown)
Trying to reveal Primary to Sideband Bridge (P2SB),
let's hope the OS doesn't mind... done.
SBREG_BAR = 0xfd000000 (MEM)

Hiding Primary to Sideband Bridge (P2SB).

============= GPIOS =============

------- GPIO Community 0 -------

PCR Port ID: 0xaf0000

------- GPIO group GPP_A -------
0x0400: 0x0000001844000502 GPP_A0   RCIN#               
0x0408: 0x0000001944000402 GPP_A1   LAD0                
0x0410: 0x0000001a44000402 GPP_A2   LAD1                
0x0418: 0x0000001b44000402 GPP_A3   LAD2                
0x0420: 0x0000001c44000402 GPP_A4   LAD3                
0x0428: 0x0000001d44000600 GPP_A5   LFRAME#             
0x0430: 0x0000001e44000402 GPP_A6   SERIRQ              
0x0438: 0x0000001f44000102 GPP_A7   GPIO                
0x0440: 0x0000002044000700 GPP_A8   CLKRUN#             
0x0448: 0x0000002144000600 GPP_A9   CLKOUT_LPC0         
0x0450: 0x0000102244000600 GPP_A10  CLKOUT_LPC1         
0x0458: 0x0000002344000200 GPP_A11  GPIO                
0x0460: 0x0000002444000300 GPP_A12  GPIO                
0x0468: 0x0000002544000200 GPP_A13  GPIO                
0x0470: 0x0000002644000600 GPP_A14  SUS_STAT#           
0x0478: 0x0000002744000502 GPP_A15  SUS_ACK#            
0x0480: 0x0000002844000200 GPP_A16  GPIO                
0x0488: 0x0000002944000200 GPP_A17  GPIO                
0x0490: 0x0000002a44000201 GPP_A18  GPIO                
0x0498: 0x0000002b44000603 GPP_A19  ISH_GP1             
0x04a0: 0x0000002c44000200 GPP_A20  GPIO                
0x04a8: 0x0000102d84000200 GPP_A21  GPIO                
0x04b0: 0x0000002e04000200 GPP_A22  GPIO                
0x04b8: 0x0000002f04000200 GPP_A23  GPIO                
------- GPIO Group GPP_B -------
0x04c0: 0x0000003044000700 GPP_B0   CORE_VID0           
0x04c8: 0x0000003144000700 GPP_B1   CORE_VID1           
0x04d0: 0x0000003244000200 GPP_B2   GPIO                
0x04d8: 0x0000003344000200 GPP_B3   GPIO                
0x04e0: 0x0000003444000200 GPP_B4   GPIO                
0x04e8: 0x0000003544000200 GPP_B5   GPIO                
0x04f0: 0x0000003644000200 GPP_B6   GPIO                
0x04f8: 0x0000003744000702 GPP_B7   SRCCLKREQ2#         
0x0500: 0x0000003844000702 GPP_B8   SRCCLKREQ3#         
0x0508: 0x0000003944000702 GPP_B9   SRCCLKREQ4#         
0x0510: 0x0000003a44000702 GPP_B10  SRCCLKREQ5#         
0x0518: 0x0000003b44000700 GPP_B11  EXT_PWR_GATE#       
0x0520: 0x0000003c44000200 GPP_B12  GPIO                
0x0528: 0x0000003d44000700 GPP_B13  PLTRST#             
0x0530: 0x0000103e44000600 GPP_B14  SPKR                
0x0538: 0x0000003f44000200 GPP_B15  GPIO                
0x0540: 0x0000004044000200 GPP_B16  GPIO                
0x0548: 0x0000004144000200 GPP_B17  GPIO                
0x0550: 0x0000304244000600 GPP_B18  GSPI0_MOSI          
0x0558: 0x0000004344000200 GPP_B19  GPIO                
0x0560: 0x0000004444000200 GPP_B20  GPIO                
0x0568: 0x0000004544000200 GPP_B21  GPIO                
0x0570: 0x0000104644000700 GPP_B22  GSPI1_MOSI          
0x0578: 0x0000004744000200 GPP_B23  GPIO                
------- GPIO Community 1 -------

PCR Port ID: 0xae0000

------- GPIO Group GPP_C -------
0x0400: 0x0000004844000702 GPP_C0   SMBCLK              
0x0408: 0x0000104944000702 GPP_C1   SMBDATA             
0x0410: 0x0000104a44000201 GPP_C2   GPIO                
0x0418: 0x0000004b44000200 GPP_C3   GPIO                
0x0420: 0x0000004c44000200 GPP_C4   GPIO                
0x0428: 0x0000004d44000200 GPP_C5   GPIO                
0x0430: 0xffffffffffffffff GPP_C6   RESERVED            
0x0438: 0xffffffffffffffff GPP_C7   RESERVED            
0x0440: 0x0000005044000700 GPP_C8   UART0_RXD           
0x0448: 0x0000005144000700 GPP_C9   UART0_TXD           
0x0450: 0x0000005244000700 GPP_C10  UART0_RTS#          
0x0458: 0x0000005344000702 GPP_C11  UART0_CTS#          
0x0460: 0x0000005444000702 GPP_C12  UART1_RXD           
0x0468: 0x0000005582880102 GPP_C13  GPIO                
0x0470: 0x0000005644000700 GPP_C14  UART1_RTS#          
0x0478: 0x0000005744000702 GPP_C15  UART1_CTS#          
0x0480: 0x0000005844000200 GPP_C16  GPIO                
0x0488: 0x0000005944000200 GPP_C17  GPIO                
0x0490: 0x0000005a44000200 GPP_C18  GPIO                
0x0498: 0x0000005b40880102 GPP_C19  GPIO                
0x04a0: 0x0000005c44000702 GPP_C20  UART2_RXD           
0x04a8: 0x0000005d44000700 GPP_C21  UART2_TXD           
0x04b0: 0x0000005e44000700 GPP_C22  UART2_RTS#          
0x04b8: 0x0000005f44000702 GPP_C23  UART2_CTS#          
------- GPIO Group GPP_D -------
0x04c0: 0x0000006044000200 GPP_D0   GPIO                
0x04c8: 0x0000006144000200 GPP_D1   GPIO                
0x04d0: 0x0000006244000200 GPP_D2   GPIO                
0x04d8: 0x0000006344000200 GPP_D3   GPIO                
0x04e0: 0x0000006444000200 GPP_D4   GPIO                
0x04e8: 0x0000006544000700 GPP_D5   ISH_I2C0_SDA        
0x04f0: 0x0000006644000700 GPP_D6   ISH_I2C0_SCL        
0x04f8: 0x0000006744000700 GPP_D7   ISH_I2C1_SDA        
0x0500: 0x0000006844000201 GPP_D8   GPIO                
0x0508: 0x0000006944000200 GPP_D9   GPIO                
0x0510: 0x0000006a44000200 GPP_D10  GPIO                
0x0518: 0x0000006b44000200 GPP_D11  GPIO                
0x0520: 0x0000006c44000200 GPP_D12  GPIO                
0x0528: 0x0000006d44000200 GPP_D13  GPIO                
0x0530: 0x0000006e44000200 GPP_D14  GPIO                
0x0538: 0x0000006f44000700 GPP_D15  ISH_UART0_RTS#      
0x0540: 0x0000007044000700 GPP_D16  ISH_UART0_CTS#      
0x0548: 0x0000007144000700 GPP_D17  DMIC_CLK1           
0x0550: 0x0000007244000700 GPP_D18  DMIC_DATA1          
0x0558: 0x0000007344000700 GPP_D19  DMIC_CLK0           
0x0560: 0x0000007444000700 GPP_D20  DMIC_DATA0          
0x0568: 0x0000007544000100 GPP_D21  GPIO                
0x0570: 0x0000007644000700 GPP_D22  SPI1_IO3            
0x0578: 0x0000007744000700 GPP_D23  I2S_MCLK            
------- GPIO Group GPP_E -------
0x0580: 0x0000101842100100 GPP_E0   GPIO                
0x0588: 0x0000001944000702 GPP_E1   SATAXPCIE1          
0x0590: 0x0000001a44000502 GPP_E2   SATAXPCIE2          
0x0598: 0x0000001b40000000 GPP_E3   GPIO                
0x05a0: 0x0000001c04000700 GPP_E4   SATA_DEVSLP0        
0x05a8: 0x0000001d04000700 GPP_E5   SATA_DEVSLP1        
0x05b0: 0x0000001e44000200 GPP_E6   GPIO                
0x05b8: 0x0000001f44000100 GPP_E7   GPIO                
0x05c0: 0x0000002044000700 GPP_E8   SATALED#            
0x05c8: 0x0000002144000200 GPP_E9   GPIO                
0x05d0: 0x0000002244000200 GPP_E10  GPIO                
0x05d8: 0x0000002344000200 GPP_E11  GPIO                
0x05e0: 0x0000002444000200 GPP_E12  GPIO                
0x05e8: 0x0000002544000700 GPP_E13  DDPB_HPD0           
0x05f0: 0x0000002644000700 GPP_E14  DDPC_HPD1           
0x05f8: 0x0000002742840102 GPP_E15  GPIO                
0x0600: 0x0000002880880102 GPP_E16  GPIO                
0x0608: 0x0000002944000702 GPP_E17  EDP_HPD             
0x0610: 0x0000002a44000702 GPP_E18  DDPB_CTRLCLK        
0x0618: 0x0000102b44000702 GPP_E19  DDPB_CTRLDATA       
0x0620: 0x0000002c44000702 GPP_E20  DDPC_CTRLCLK        
0x0628: 0x0000102d44000702 GPP_E21  DDPC_CTRLDATA       
0x0630: 0x0000002e40100000 GPP_E22  GPIO                
0x0638: 0x0000102f44000201 GPP_E23  GPIO                
------- GPIO Community 2 -------

PCR Port ID: 0xad0000

-------- GPIO Group GPD --------
0x0400: 0x0000005004000702 GPD0     BATLOW#             
0x0408: 0x0000005104000702 GPD1     ACPRESENT           
0x0410: 0x0000005200880502 GPD2     LAN_WAKE#           
0x0418: 0x0000305304000702 GPD3     PWRBTN#             
0x0420: 0x0000005404000700 GPD4     SLP_S3#             
0x0428: 0x0000005504000700 GPD5     SLP_S4#             
0x0430: 0x0000005604000700 GPD6     SLP_A#              
0x0438: 0x0000005704000301 GPD7     GPIO                
0x0440: 0x0000005804000700 GPD8     SUSCLK              
0x0448: 0x0000005904000700 GPD9     SLP_WLAN#           
0x0450: 0x0000005a04000700 GPD10    SLP_S5#             
0x0458: 0x0000005b04000500 GPD11    LANPHYPC            
------- GPIO Community 3 -------

PCR Port ID: 0xac0000

------- GPIO Group GPP_F -------
0x0400: 0x0000003044000700 GPP_F0   I2S2_SCLK           
0x0408: 0x0000003144000700 GPP_F1   I2S2_SFRM           
0x0410: 0x0000003244000700 GPP_F2   I2S2_TXD            
0x0418: 0x0000003344000700 GPP_F3   I2S2_RXD            
0x0420: 0x0200003444000702 GPP_F4   I2C2_SDA            
0x0428: 0x0200003544000702 GPP_F5   I2C2_SCL            
0x0430: 0x0200003644000702 GPP_F6   I2C3_SDA            
0x0438: 0x0200003744000702 GPP_F7   I2C3_SCL            
0x0440: 0x0200003844000702 GPP_F8   I2C4_SDA            
0x0448: 0x0200003944000702 GPP_F9   I2C4_SCL            
0x0450: 0x0200003a44000b02 GPP_F10  ISH_I2C2_SDA        
0x0458: 0x0200003b44000b02 GPP_F11  ISH_I2C2_SCL        
0x0460: 0x0000003c44000700 GPP_F12  EMMC_CMD            
0x0468: 0x0000003d44000700 GPP_F13  EMMC_DATA0          
0x0470: 0x0000003e44000700 GPP_F14  EMMC_DATA1          
0x0478: 0x0000003f44000700 GPP_F15  EMMC_DATA2          
0x0480: 0x0000004044000700 GPP_F16  EMMC_DATA3          
0x0488: 0x0000004144000700 GPP_F17  EMMC_DATA4          
0x0490: 0x0000004244000700 GPP_F18  EMMC_DATA5          
0x0498: 0x0000004344000700 GPP_F19  EMMC_DATA6          
0x04a0: 0x0000004444000700 GPP_F20  EMMC_DATA7          
0x04a8: 0x0000004544000700 GPP_F21  EMMC_RCLK           
0x04b0: 0x0000004644000700 GPP_F22  EMMC_CLK            
0x04b8: 0x0000004740100100 GPP_F23  GPIO                
------- GPIO Group GPP_G -------
0x04c0: 0x0000004844000700 GPP_G0   SD_CMD              
0x04c8: 0x0000004944000102 GPP_G1   GPIO                
0x04d0: 0x0000004a44000700 GPP_G2   SD_DATA1            
0x04d8: 0x0000004b44000700 GPP_G3   SD_DATA2            
0x04e0: 0x0000004c44000700 GPP_G4   SD_DATA3            
0x04e8: 0x0000004d44000702 GPP_G5   SD_CD#              
0x04f0: 0x0000004e44000700 GPP_G6   SD_CLK              
0x04f8: 0x0000004f44000702 GPP_G7   SD_WP               


